ratings,rev_head,revs
5.0,This is perfect for those who want a functional,"I've had this same laptop before and it lasted 7 years.  I don't play video games or use a lot of storage.  This is perfect for those who want a functional, portable, reliable computer and don't wish to pay $500 +"
1.0,Solución urgente,La computadora tiene meses de comprada y ya no prende ... tiene problemas con la batería
1.0,Total waste of money! World's slowest computer!,This computer is so slow it's not even usable. It takes 5 minutes for the document folder to open. What a joke!
4.0,Slow... and the touchpad is erratic.,"I'm kind of disappointed... This would've been a good computer for the price if it weren't so erratic when it came to speed and the touch pad... I'm going to hang on to it for a while, unless it freezes completely, and then move on to something else.  It's all about the Benjamins, and this is all I can afford for the time being."
5.0,It's a Dell!,"Lots of things go into the creation of a good product.  Dell has done just that: made a good, no, very good product and I am ever so pleased with the way it performs.  It is not for the ""gamer"", it is just for simple folk like me who need it to email, write letters, chart things and browse the net.  It is, in a word, perfect."
5.0,"Entry level price, high end features!","I purchased this laptop to replace a 9 year old model laptop. This HP was simple to set up and use. The numerous updates on functionality, ease of use and slick design are my highlights."
1.0,Worst laptop ever,Worst laptop ever! Within two days it completely stopped working. Called dell and they wanted more money and still dont fixed. Looked up the issues we're having and apparently numerous people had this same problem with this same model. Save your money!
4.0,Dell Yeah,My son needed something decent on the cheap for work. Works fine right out of the bix
1.0,Will have to buy upgrades,"Very slow, if you want a cheap laptop that's what you will get. You will spend 400$ just on upgrades. Hdd or hard disk drive is out dated tech that will make you want to pull your hair out waiting minutes just for something to open from desktop"
5.0,Five Stars,"i love it, for the price it's the best. life baterry its amazing"
3.0,Battery short,It was easy to set up.  It takes you through the set up fast.  The draw back is the battery is only about 3 hours and you need to plug in.
1.0,Wont charge,"It keeps saying that the cord that came with it is wrong and wont charge the battery. I dont want to send the laptop back, but cant figure out how to contact the seller to see if they can send a power cord to see if that fixes it."
5.0,laptop,great price and convenient and easy to use
5.0,fast shipping& reasonable pricing,beautiful  computer  at a reasonable  price
1.0,junk laptop,"I received this laptop quickly and it was in working order. Amazon did a great job. However, the laptop is junk. It doesn't work properly. Half of the time it won't even turn on. When it does, it is extremely slow. Not happy at all. Dell should be ashamed for even making it."
1.0,Awful do not purchase!,"Horrible. SLOW!  Not sure what the issues are, but this is the slowest computer I’ve ever owned."
4.0,College student it’s perfect,"Say what you want about dell, they have been pushing computers since the cows had a share in stock. Package arrived factory sealed computer is clean and smooth runs a little slower then your “high performance” pooters honestly my wife loves it I love it it runs great and arrived new... plus it’s a Dell.... we deffinently needed this for school and she loves her early Xmas present... happy wife happy life!"
3.0,Good value,For the price it's about what I expected. Functions well. Negatives are a less than stellar screen and as other reviewers have commented it is very slow. I would purchase this again and am pleased with the item. I consider it a good value.
5.0,Happy wife.  Happy life.,"This was an anniversary gift to my wife.  She likes that the laptop is light weight, has the number board and is easy for her to do research on."
3.0,Weight,"I specifically ordered this computer based upon what it offered and its listed light weight. According to the information, the computer was supposed to weight 3.6 pounds. It weighs  4.8 pounds according to our scales. That does not sound like much -- until you add it to a bookbag and carry it up 40 steps in a 100+ year-old school. And, of course it cannot be returned after opening..."
2.0,You get what you pay for,I had to uninstall and reinstall the audio drivers 5 times before I finally got sick of it and returned the laptop. It would randomly stop playing audio through the headphones and only come out the speakers. The processing speed is slow and the material feels cheap.
5.0,Good Value,"I purchased this for my wife, and she loves it. She has thousands of photos that she keeps on it and the graphics let her show them off. It performs other tasks quite well, such as word processing and spreadsheets. I will probably update the hard drive to an SSD at some point, but not right away. It's a great machine for the money involved."
2.0,"Basic, maybe a lil less!!!","Nothing exciting.... Slow as a snail... Good for documents but anything multimedia related, just forget about it.. I use it for coding class and it's giving me bare minimum speed."
1.0,Don't buy this one!!,Biggest pile of doo. Don't waste your money because all this is is a paper weight.  An expensive paper weight.
4.0,Good for the basics,"The second time was the charm, the first laptop came and it was DOA, this second one boots up but lags. Good for email and normal surfing"
1.0,Don't waste your money,It really is a cheap computer that can barely do anything. Save your money and buy something else. I'll never buy another Dell regardless of cost based on my experience with this computer. A galaxy s7 cellphone is more capable then it.
5.0,Easy,Easy to use
4.0,Dell use to be a good brand,To slow to download and stook
1.0,Disappointment,"Very disappointed in the quality of this laptop. I did not want to purchase a expensive laptop mainly because this one would only be temporarely, but the mainframe kept glitching and the software system was extremely slow. I am not a person that usually writes customer reviews, but I couldn't help myself this time due to my experience. Hope I can still get my money back."
1.0,One Star,wish i could return it. Can't run anything on it because it is too slow. Buy any other laptop
4.0,Not upgradeable,"Bought it for my son, he said it works great for his college classes. But it’s not upgradeable."
1.0,I bought this to work not sit there and do nothing,It's a dud worked one day now it will do nothing at all very sorry I bought it would like to send it back but it already has my info on it and no way to remove it. Will never buy another laptop from Amazon.
5.0,"Great price, works great for my application (work from ...","Great price, works great for my application (work from home, interact with my office), I'm not a fan of the touchpad, but I bought a wireless mouse and it is PERFECT"
1.0,Not a good  product,"Just to boot up the computer,  I have to wait at least 20 minutes. When using the computer with Word or quickbooks or any app or internet use, the computer takes minutes to process a transaction or go to the next page or even save a document.  Now we are past the 30 day return window with an almost useless computer."
5.0,Would not reccomend,Very slow right out of the box
5.0,"Big clear, crisp screen",Bought this for my son who is homeschooled this year. Easy setup. So far he loves it.
1.0,SLLLLOOOOWWWWW...... And frustrating,Didn't expect much for the price but this might be slower than the one I had to replace because it was old and slow. I just use it as a home computer for work and do VERY basic tasks such as internet and cloud based Google programs. Dont waste your money.
5.0,Student,Gift for granddaughter
1.0,SLOW,This computer is so slow it bairly starts up. I could not even get it to recognize my printer because it kept freezing up.
4.0,"Low ram, replace windows with linux or get some more/ rest of laptop good",I got my laptop from Emily's store and it was in good condition. I immediately changed the Operating System to Ubuntu and then I cracked open the shell. There was two  ddr4 sodimm slots. I plan on putting a 16 gb kit or another 4 gb sodimm ram stick into the enpty slot. Most of everyones problems stem from how much ram memory windows needs. If you need windows then try to get a professional to install some more ram since you will be voiding the warranty if you attempt to do this.
5.0,Out Standing!!!,This is a great laptop for the price. Go DELL!!!!!!
4.0,Solid Internet Laptop,Good value laptop for general computing and internet usage.
1.0,This is a very S-L-O-W machine.,S L O W.  Period.  It was so frustrating I returned it.
1.0,Don't buy this!,This is the most absolute worst laptop I've ever wasted my money on.  Bought it less than three months ago and it's already shot.  Shuts itself down and gives an error message from turning it on. Then repeats to shut down.  Was slow from the moment I got it.  I'll no longer buy a Dell because of this.  Don't buy this laptop
3.0,"Works good, but is slow and often reboots for no apparent reason","Works good, but is slow and often reboots for no apparent reason"
5.0,Birthday,Gift for family member
1.0,Slower than a turtle in molasses!,"We have had the computer < 2 months and this system is slower than our old computer from 5 years ago doing the same tasks.  I will reach out supplier but it is now beyond the return window.  I don't know what to do but I would never buy this system again, nor would I recommend anyone else to either."
3.0,Laptop Speaker Not Great,"The laptop is ok for the money except the speaker is not very good. When I ran a diagnostic trouble shooter, it said there is a generic speaker detected. I don’t think there is anything that can be done for that."
1.0,this is crap,if it was any slower it would be off.
2.0,Two Stars,I ordered this computer and The speakers have static!  What the heck!  Is this a refurbished/used computer?
3.0,Glad I purchased,So far so good
2.0,I have owned multiple computers over the years and never had one behave like this one,"This computer is defective.  I bought to replace one I already had that was several years old, and starting to have serious problems.  I just opened the box two weeks ago when the old machine finally quit.  This one has been nothing but trouble.  It freezes up constantly.  I have worked with both Dell and Microsoft to try to resolve the problem, this morning when I went to restart it after an upgrade, it refuses to come back on. I have owned multiple computers over the years and never had one behave like this one.  There has to be something defective in the computer itself.  Where do I send it to return it?  And how do I get my money back?"
1.0,My first Dell. It will also be my last.,"I have had issue after issue with this computer, starting with it not charging, then it wouldn't connect to Wi-Fi, and now the caps lock button won't turn off. Every time I tap it my computer freezes up. How do I return this thing?"
3.0,Three Stars,For a last minute purchase when our daughter quickly needed a laptop its ok.
5.0,Dell makes a good computer.,"Use this computer for gaming and watching dvds.  Works great, very good graphics, good screen resolution."
4.0,Unfortunately this laptop is a piece of CRAP. Got it on May 16th and on June ...,"Unfortunately this laptop is a piece of CRAP. Got it on May 16th and on June 28th it does not run any programs. Initially, it was at best, adaquate and sensing that more problems could arise I should have followed my gut and retunred it. By now I have I have missed my one month window to return it. Now I am stuck with this non functional piece of garbage. I am not a millionaire that can afford to lose $300.00 at a pop."
1.0,Beyond slow,The laptop takes around 5 minutes to start up. Out of the box the cpu steadily ran at 95% with no apps open. Takes a long time to launch an such as Excel. Laptop was returned
1.0,When you buy a product that works.,Did not even get to use it to the capacity because it would over hit and turn off. Very poor quality product!
5.0,Love it,Works great!
2.0,I bought it for my dad,Would not connect to my printer
1.0,hard to work,"The computer was fine at the beginning but went downhill since.You turn the computer on and doesn't even go on,so you turn it off then turn it back on again it is so slow even to get to the internet!! I should of bought a different computer from another company."
4.0,Nice Product,Very nice for price
5.0,Nice,So far so good
2.0,Hit and miss,Have already had to be repaired
1.0,not worth the money,Slow Slow Slow. Ended up giving it to my 4 year old grandson
4.0,Good product for price,So far so good.
5.0,Muy bueno,Muy bueno
